[
  {
    "slug": "pizza-bianca-a-lunga-lievitazione",
    "titolo": "Pizza bianca a lunga lievitazione",
    "descrizione": "Impasto con pochissimo lievito e 24 ore in frigo: si digerisce e sa di pane vero. In teglia, con patate e rosmarino oppure mortadella e stracciatella dopo la cottura. Fai l'impasto il sabato, mangi la domenica.",
    "categoria": "piatto-unico",
    "difficolta": "difficile",
    "tempi": { "preparazione": 30, "cottura": 20, "riposo": 1440 },
    "porzioni": 1,
    "costo": { "fascia": "basso", "stima_eur": 1.8 },
    "attrezzatura": ["forno", "teglia"],
    "tag": ["weekend", "low-cost", "da-ospiti"],
    "dieta": ["vegetariano"],
    "origine": "Italia · Roma",
    "reinventata": null,
    "ingredienti": [
      { "id": "farina-00", "qta": 200, "unita": "g", "note": "meglio Manitoba o tipo 65 portoghese" },
      { "id": "lievito-di-birra", "qta": 1, "unita": "g", "note": "secco (un terzo di cucchiaino)" },
      { "id": "sale", "qta": 4, "unita": "g" },
      { "id": "olio-evo", "qta": 2, "unita": "cucchiai" },
      { "id": "patate", "qta": 1, "unita": "pz", "note": "piccola, a fette sottilissime" },
      { "id": "rosmarino", "qta": 1, "unita": "rametti" },
      { "id": "mortadella", "qta": 60, "unita": "g", "opzionale": true, "note": "per la variante bianca a crudo" },
      { "id": "stracciatella", "qta": 60, "unita": "g", "opzionale": true }
    ],
    "procedimento": [
      { "n": 1, "titolo": "Impasto (giorno 1)", "testo": "Sciogli il lievito in 140 ml di acqua tiepida. Mescola con la farina in una ciotola fino a quando non c'è più farina asciutta, copri e aspetta 20 minuti. Aggiungi sale e un cucchiaio d'olio, impasta 8–10 minuti sul piano finché è liscio ed elastico (è molto morbido: bagna le mani invece di aggiungere farina).", "minuti": 25 },
      { "n": 2, "titolo": "Frigo 24 ore", "testo": "Metti l'impasto in una ciotola unta, copri con pellicola e lascia in frigo 18–24 ore. Crescerà lentamente e farà bolle.", "minuti": 5 },
      { "n": 3, "titolo": "Stesura (giorno 2)", "testo": "Tira fuori l'impasto 2 ore prima. Ungi una teglia piccola (25×20 cm), rovescia l'impasto e allargalo con le dita unte spingendo dal centro ai bordi, senza schiacciare le bolle. Se si ritira, aspetta 10 minuti e riprova. Lascia riposare 30 minuti.", "minuti": 15 },
      { "n": 4, "titolo": "Condimento e forno", "testo": "Scalda il forno al massimo (250 °C) per 15 minuti. Condisci con patate a fette sottili condite con olio, sale e rosmarino (oppure solo olio e sale grosso). Cuoci nel ripiano più basso 15–18 minuti finché il fondo è dorato.", "minuti": 20 },
      { "n": 5, "titolo": "Variante a crudo", "testo": "Per la versione mortadella: cuoci la pizza solo con olio e sale; appena esce, mortadella a fette e stracciatella sopra. Il calore le scalda appena.", "minuti": 2 }
    ],
    "consigli": "L'impasto molto idratato fa paura ma dà la pizza migliore: non aggiungere farina, usa acqua sulle mani. Il forno di casa va al massimo, ripiano basso.",
    "conservazione": "L'impasto in frigo regge fino a 48 ore. La pizza cotta si riscalda in padella coperta 3 minuti.",
    "varianti": ["Focaccia: più olio, sale grosso e rosmarino, senza patate.", "Con passata e mozzarella: la margherita, cotta 12 minuti."],
    "kcal": 780,
    "foto": { "copertina": "img/pizza-bianca-a-lunga-lievitazione.webp", "prompt": "rectangular pan pizza bianca with thin potato slices and rosemary, airy golden crumb visible on a cut edge, light wooden board" },
    "fonte": "Metodo pizza in teglia romana, adattato"
  },
  {
    "slug": "focaccia-genovese",
    "titolo": "Focaccia genovese",
    "descrizione": "Alta un dito, unta, con i buchi pieni di salamoia. Tre ore di lievitazione in tutto, quasi tutte di attesa. Cena con formaggi e salumi, o colazione il giorno dopo.",
    "categoria": "piatto-unico",
    "difficolta": "media",
    "tempi": { "preparazione": 25, "cottura": 18, "riposo": 180 },
    "porzioni": 1,
    "costo": { "fascia": "basso", "stima_eur": 0.9 },
    "attrezzatura": ["forno", "teglia"],
    "tag": ["weekend", "low-cost", "avanzi"],
    "dieta": ["vegano", "senza-lattosio"],
    "origine": "Italia · Liguria",
    "reinventata": null,
    "ingredienti": [
      { "id": "farina-00", "qta": 200, "unita": "g" },
      { "id": "lievito-di-birra", "qta": 3, "unita": "g", "note": "secco (una bustina piccola)" },
      { "id": "sale", "qta": 4, "unita": "g" },
      { "id": "zucchero", "qta": 1, "unita": "cucchiaini" },
      { "id": "olio-evo", "qta": 4, "unita": "cucchiai", "note": "impasto + teglia + salamoia" },
      { "id": "rosmarino", "qta": 1, "unita": "rametti", "opzionale": true }
    ],
    "procedimento": [
      { "n": 1, "titolo": "Impasto", "testo": "Sciogli lievito e zucchero in 120 ml di acqua tiepida. Aggiungi farina, 1 cucchiaio d'olio e infine il sale; impasta 8 minuti finché è liscio. Ciotola unta, coperta, 1 ora in un posto tiepido (forno spento con la luce accesa).", "minuti": 15 },
      { "n": 2, "titolo": "In teglia", "testo": "Ungi bene una teglia piccola (20×25 cm), rovescia l'impasto e allargalo con le mani unte. Copri e lascia lievitare 1 ora: deve raddoppiare.", "minuti": 5 },
      { "n": 3, "titolo": "Buchi e salamoia", "testo": "Mescola 2 cucchiai d'olio con 2 cucchiai d'acqua e un cucchiaino raso di sale. Affonda le dita nell'impasto fino al fondo facendo tanti buchi, versa la salamoia sopra: deve riempire i buchi. Rosmarino se vuoi. Altri 30 minuti di riposo.", "minuti": 5 },
      { "n": 4, "titolo": "Forno", "testo": "220 °C, ripiano medio-basso, 15–18 minuti finché è dorata. Appena esce, un filo d'olio. Mangiala tiepida.", "minuti": 18 }
    ],
    "consigli": "La salamoia (acqua + olio + sale) è ciò che rende la focaccia genovese diversa da tutte le altre: non saltarla.",
    "conservazione": "Un giorno in un sacchetto di carta. Si congela a pezzi e si rigenera in forno 5 minuti.",
    "varianti": ["Con cipolle a fettine sottili sopra prima del forno.", "Con olive nere schiacciate nell'impasto."],
    "kcal": 820,
    "foto": { "copertina": "img/focaccia-genovese.webp", "prompt": "golden Genovese focaccia with deep dimples filled with olive oil and flaky salt, cut square, light wooden board" },
    "fonte": "Tradizione ligure"
  },
  {
    "slug": "parmigiana-di-melanzane",
    "titolo": "Parmigiana di melanzane",
    "descrizione": "Melanzane grigliate (versione leggera) a strati con passata cotta col basilico, mozzarella e parmigiano. In una pirofila piccola per uno; il giorno dopo è più buona.",
    "categoria": "piatto-unico",
    "difficolta": "media",
    "tempi": { "preparazione": 30, "cottura": 45, "riposo": 15 },
    "porzioni": 1,
    "costo": { "fascia": "basso", "stima_eur": 2.6 },
    "attrezzatura": ["padella", "forno", "teglia", "griglia"],
    "tag": ["weekend", "avanzi", "classico"],
    "dieta": ["vegetariano", "senza-glutine"],
    "origine": "Italia · Campania / Sicilia",
    "reinventata": null,
    "ingredienti": [
      { "id": "melanzane", "qta": 350, "unita": "g", "note": "una grande, a fette da 5 mm per il lungo" },
      { "id": "passata", "qta": 250, "unita": "ml" },
      { "id": "mozzarella", "qta": 100, "unita": "g", "note": "ben sgocciolata" },
      { "id": "parmigiano", "qta": 30, "unita": "g" },
      { "id": "basilico", "qta": 6, "unita": "foglie" },
      { "id": "aglio", "qta": 1, "unita": "spicchi" },
      { "id": "olio-evo", "qta": 3, "unita": "cucchiai" }
    ],
    "procedimento": [
      { "n": 1, "titolo": "Sugo", "testo": "Scalda un cucchiaio d'olio con l'aglio, aggiungi la passata, sale, basilico e cuoci 20 minuti a fuoco basso. Togli l'aglio.", "minuti": 20 },
      { "n": 2, "titolo": "Melanzane", "testo": "Intanto griglia le fette di melanzana su una padella (o griglia) ben calda, 3 minuti per lato, spennellate d'olio, finché hanno le righe e sono morbide. Sala leggermente.", "minuti": 15 },
      { "n": 3, "titolo": "Strati", "testo": "Forno a 190 °C. In una pirofila piccola: velo di sugo, strato di melanzane, sugo, mozzarella a pezzetti, parmigiano, basilico. Ripeti per 3 strati e finisci con sugo e parmigiano (niente mozzarella in cima: brucia).", "minuti": 8 },
      { "n": 4, "titolo": "Forno e riposo", "testo": "Cuoci 25 minuti finché borbotta ai bordi e la superficie è dorata. Aspetta 15 minuti prima di tagliare, o si sfalda.", "minuti": 40 }
    ],
    "consigli": "La mozzarella deve essere asciutta: tagliala un'ora prima e lasciala in un colino, altrimenti la parmigiana 'annega'.",
    "conservazione": "In frigo 3 giorni, si congela. Fredda del giorno dopo è la versione preferita di molti.",
    "varianti": ["Melanzane fritte invece che grigliate: la versione originale, più ricca.", "Con zucchine grigliate, stesso metodo."],
    "kcal": 560,
    "foto": { "copertina": "img/parmigiana-di-melanzane.webp", "prompt": "single portion of eggplant parmigiana with visible layers, tomato sauce, melted mozzarella, basil leaf, white ceramic plate" },
    "fonte": "Tradizione del Sud"
  },
  {
    "slug": "polenta-con-funghi-e-salsiccia",
    "titolo": "Polenta con funghi e salsiccia",
    "descrizione": "Polenta morbida (istantanea o farinha de milho) con un intingolo di salsiccia, funghi e vino bianco. Piatto di montagna, perfetto per Bragança a gennaio.",
    "categoria": "piatto-unico",
    "difficolta": "facile",
    "tempi": { "preparazione": 10, "cottura": 35, "riposo": 0 },
    "porzioni": 1,
    "costo": { "fascia": "basso", "stima_eur": 2.4 },
    "attrezzatura": ["pentola", "padella"],
    "tag": ["inverno", "autunno", "avanzi", "low-cost"],
    "dieta": ["senza-glutine"],
    "origine": "Italia · Alpi",
    "reinventata": null,
    "ingredienti": [
      { "id": "polenta", "qta": 80, "unita": "g" },
      { "id": "salsiccia", "qta": 100, "unita": "g" },
      { "id": "funghi-champignon", "qta": 150, "unita": "g" },
      { "id": "cipolla", "qta": 0.5, "unita": "pz" },